文章標題,作者,時間,內文,推文數量,噓文數量,箭頭數量
[心得] 從學生到出社會五年心得,bumimo2801,10/04,"文長慎入

先介紹自己，畢業後國考通過醫院執業中(非醫牙)

為什麼進入股市，因為長輩的投資建議我思考後開戶進入股市花花世界

2020年我才21歲，還在上大學，第一檔買的股票就是面板小貓-彩晶

買入時成本9.67，當然也只有一張，抱了一個月脫手價格12.45

心想著原來買股票會賺錢是這種感覺，後來只要我領薪水就直接全數投入股市買股

當然兼職收入不多，大概就2萬初頭，2020年底到2021/4月大概都是買不到10元的股

載浮載沉，一直到4月鋼鐵股爆發，聚亨、官田鋼、燁輝、興櫃燁聯、中鋼..等等

心想哇，沒想到我都中了!我真的太厲害了，抱著就有10幾萬損益

還有面板股的起飛，友達群創彩晶從個位數漲到20-30，只是買很少就是了

4/27第一次接觸當沖，也就是航海王-長榮，那天我在課堂上買入2張長榮

成本78.5，幾分鐘時間賣出80，大賺了2000多元，真的好開心

後幾天都在抽面板跟海運當沖，但有賺有賠，一直到5/4....

買入長榮1張85.9，兩張84.9，還有幾張往下攤平的價位...最終跌停，為了不違約交割

只能排隊賣在跌停價，當下的我陷入恐慌，害怕，心想我好像要死了，拜託讓我賣掉

還好，最後賣掉了，但我還要貼上10幾萬才能不違約，直接把庫存的一些賺錢權證

鋼鐵面板權出清(其實也幾乎清倉了)，才能籌出這些錢不違約交割

在這之後我好像陷進了那天跌停的心境，什麼東西都不敢買不敢抱，一直到8月

我才重新進場，但也不敢碰當沖了，將近1~2年的載浮載沉，什麼都沒賺到

2022年底到2023年中，我很瘋狂權證，但最終都是賠錢..就不多說了

接下來，就是我地獄的開始

「期貨」

2023年10月我開啟了期貨世界，為什麼會開，因為股市爆料XX會聊天室

當時我很常在裡面跟很多人討論股市，隨後被推薦期貨也不錯

所以才有了開期貨戶的念頭，小台1點就有50元收益，感覺很爽

那時台指大約落在16700附近，我開戶後觀望幾天，下單，空

隔天賺了8000台幣，哇，又是美好開局呢

11月直接衝了大台一口，空16012，沒記錯應該是隔天日盤痛嘎300多點

損益高達-7萬，我又開始恐慌了，為了不多賠只能趕快平倉

後續兩周我都抽大台，但當然地，沒有被眷顧，賠了更多

又回到我小台的買賣，到隔年4月都沒有什麼起色，也賺不回我賠的

但就是不死心，覺得我可以，我不可能倒下

4月開始我接觸了「個股期貨」，瘋狂大賠的開始來了

光是世紀鋼我就賠掉15萬，就算其他檔有賺錢也不超過1萬

就在台指個股期相互的做單，又回到載浮載沉的生活

24年8月，我貸款100萬投入期貨想要重新振作

好死不死遇到台指大殺，其實也就1000~2000點左右

我買入廣達期貨，買入小型台指，但完全抱不住

9月初全平倉，貸款的100萬瞬間少了10萬

於是我心想，好吧，都大殺了那我建倉小型台積總可以了吧?

於是9/10開始買進小型台積，成本大概900初

9/12漲到940我又全出脫，當晚為什麼漲我也不太清楚了

沒記錯應該是說要降息了吧

9/13~19買進元大美債，建倉數約10口，成本31.6左右

其餘仍然在台指世界大殺四方

9月底我還在加碼元大美債攤平，但可能真的加太快

損益一下就高達15~20萬了

10月台指期貨賠了15萬，個股期貨賠了20多萬

11月美債期貨全數出清，我撐不住了

但好險有出，隔年一直跌到25附近，甚至有一天期貨是開跌停

12月又回到台指個股期，整個月又多賠了15萬

25年1月~4月，我幾乎快沒什麼錢能再投入股市跟期貨

4月大屠殺，我也不敢進場了，手上就剩下不到10萬

一直空手

期貨短短不到2年，賠了80多萬

5月我選擇了走海期，但其實還是有做一點小台

最主要是操作迷你日經，小道瓊

其實能說的也不多了，還是一句話，載浮載沉

賺了海期，賠在台指

9月初玩黃金期貨，大概賺了1000多美，但一半也賠在台指

結算下來海期大概賺了15萬台幣吧，大概10萬又賠在台指

手上現在也就剩一口迷你日經空單了

但這單在昨天起床時，已經噴到外太空創新高

損益-15萬日幣，可動用甚至是負數

半夜也收到簡訊要補權益數了

今天又聽到高市早苗當選，可能禮拜一開盤又會漲個1000點以上吧

到時可能-25萬日幣

-

以上是我五年股市加期或加海期的歷程
其實打完當下(也就是現在)我的心情已經很死了
你問我會想哭嗎，當然會，但不知道為什麼我也哭不出來
很多時候我心一直都是想要在低點建倉，就好比台積電
去年買在900，一直抱著遇到4月大屠殺，我也不會爆倉
頂多損益很綠，但不至於要補錢，現在甚至創新高了
當然一開始我的投資方法就是完全錯的，我也有研究很多技術分析
股票基本面，但我就是怕，我仍然忘不掉當初長榮當沖跌停那天
後續操作一直都在影響我，只活在短沖的世界裡，所以無限放大自己的虧損
看到版上很多人分享賺錢，投資心法，當下我也覺得我該改變了
但不知道為什麼，操作了，進場了，一切都變了
我沒辦法照著紀律走，明明告訴自己看錯就要離場，等待下一次機會
這樣才不會因為大賠，又死抱著不離場，結果離場了人家就上去了
短短五年，我賠了100多萬，天天活在憂鬱當中，但沒去看病XD
賠錢我完全不敢跟別人說，我女友也不知道我賠這麼多
但她其實有發現過我面色很難看，整個人很憂鬱，也問過我是不是股市輸光了?
我不敢講..我只回她說沒有呀，雖然有賠但不多，沒事
因為我去年貸款完就跟他保證今年我們一定會很好過，但事與願違地
相反，已經快賠光了，雖然不影響日常生活，只是要多負擔一筆貸款還款而已
原以為可以用一年時間好好把錢賺到，最後一場空，哈哈~
沒什麼能說了，希望版上的各位都能遵守紀律，沒有到不能貸款玩股票，但不要像我一樣
全部都賠上了，生活重心嚴重失衡，天天為了憂鬱而憂鬱

祝大家投資順利~Bye~

--※ 發信站: 批踢踢實業坊(ptt.cc), 來自: 210.62.204.184 (臺灣)※ 文章網址:https://www.ptt.cc/bbs/Stock/M.1759588023.A.084.html推DDDDRR: 沒事 錢在賺就有 身體顧好還年輕10/04 22:29推HiuAnOP: 啊….10/04 22:29→HiuAnOP: 只能說認真工作買指數吧…10/04 22:30推DDDDRR: 問題在於信貸100萬時 心態已經不對了10/04 22:31→DDDDRR: 當沖時體驗市場 輸光了還去借錢回來賭一把就是問題10/04 22:32→DDDDRR: 如果只是借錢過生活又是一回事10/04 22:32推TAKEZOU: 5年才賠100萬 菜鳥醫生5個月就賺回來了10/04 22:33推goodjop: 九賭九輸10/04 22:33推enthusiastic: 執業醫生薪水all in 2498明年退休10/04 22:35推ksjr: 跟詐騙有點像一開始給你點甜頭後面就停不下來了10/04 22:36→wuling1001: 雖說趁年輕可以多嘗試 但你賭得有點大10/04 22:36推tomdavis: 去年2萬4的時候也有個賠起千萬的 後來整個賺回來10/04 22:36噓a000000000: 還以為是少年股神結果4賠錢廢文浪費我時間按end10/04 22:37推icedog122: 買指數啦10/04 22:38→wuling1001: 五年賠一百多其實還好 調整心態 還有機會重新開始10/04 22:38推waitsun2010: 謝謝你發文10/04 22:38→waitsun2010: 再重新開始就好了10/04 22:38推keel90135: 不是才10月 怎麼一堆心得文年報出來了= =10/04 22:39推ch8426zer: 別做空，空單沒這麼好賺，做多永遠有希望10/04 22:39→keel90135: 這是什麼畢業季嗎10/04 22:39→loom0et0bust: 恩….就是在賭博而已啊10/04 22:40推wuling1001: 做空台股好像都是賠錢的多？10/04 22:40推keke0421: 你就只是在賭博而已10/04 22:41推yukiinsummer: 還好賠的早還能調整 等存到5-60賠大的才慘10/04 22:41推x221x221: 好好的買0050別亂衝了10/04 22:41推southpeace: 那接下來呢？10/04 22:41→wuling1001: 這真的是在賭 有得到對將來有用的投資心得嗎？10/04 22:41推livewater: 完全不懂的新手無腦買0050都贏你10/04 22:42推pursuewc: 早點知道 你玩什麼會GG 就不要去碰他 至少你試過10/04 22:42推umaga1: 把貸款還完就離開股市吧10/04 22:42→jack55777100: 我從學生到出社會8年,只持有了兩隻股票,然後都因為10/04 22:43→jack55777100: 目標未達成不賺反虧,但真的不建議借錢賭博10/04 22:43→umaga1: 連0050最近都不要買了 最近散戶瘋狂搶進10/04 22:43推metallolly: 還好還有本業 ，就投0050 不要看app 就好了10/04 22:43→umaga1: 我妹也是信貸40萬賠光  現在還在還債10/04 22:43→umaga1: 我跟你賠得差不多 但我沒借貸 心理壓力小一點10/04 22:44推jerry0821: 全球這5年就是大多頭 硬要空 輸的機率本來就很高10/04 22:44推dogalan: 賠錢沒關係 重點是賠了之後你知不知道為什麼還有該10/04 22:45→dogalan: 怎麼改變 我只能說對你來說最好的方式就是遠離股市10/04 22:45推comboday: 把本業顧好，台股設定好定期定額0050後刪掉App，人10/04 22:45→comboday: 生不是只有股市而已，更何況是你這種玩法，但聽不進10/04 22:45→comboday: 去也沒辦法10/04 22:45→dogalan: 因為你把股市當賭場在玩 不醒悟遲早家破人亡10/04 22:45推keyofdejavu: 第一步就是別用融資跟貸款玩投票跟投資10/04 22:45→keyofdejavu: 專業投資人可以這樣玩，但你就不是10/04 22:46推JoyceTong: 好可憐，看在有療癒到我少賺的怨念，給你個推10/04 22:46推Marginal: 內文讀起來，這經歷有點像在賭的感覺10/04 22:46推boombastick: 接下來打算玩什麼商品呢？10/04 22:47推jason401310: 貸款要玩個股期貨直接台積電無限轉倉就好了10/04 22:47推realskyer: 我07年入股市 08就碰上金融海嘯賠了400萬...10/04 22:48→keyofdejavu: 然後是期貨權證是高手在玩的10/04 22:48→jason401310: 只開兩倍就算遇到四月那波也不會被殺出去10/04 22:48推on32: 100多萬算還好學個經驗 我上半年陪1100W多 還沒回本10/04 22:48推gnrsean: 我個股賠但沒槓桿，回頭看還是存指數就好10/04 22:49推TSMininder: 希望您說出來心情會好一些 不用擔心 過30才是初老10/04 22:49→TSMininder: 你還是去定期定額八10/04 22:50推CAFEHu: 十倍蛙：加油！堅信自己走的路，成功就是要不斷的10/04 22:50→CAFEHu: 犯錯，你才會離成功越來越近，哪個翻身故事沒賠過10/04 22:50→CAFEHu: ？10/04 22:50推howard098112: 謝謝分享…10/04 22:50推ntcbman: 給您的建議是，每天要交易前30分鐘調整好心情跟先10/04 22:50→ntcbman: 看一段行情再進場，進場後同時設定好停損停利，並且10/04 22:50→ntcbman: 一天連續停損2趟就要停。狀態好時，才一直來回操作10/04 22:50推macetyl: 阿公說 別借錢 不做空 刪帳號10/04 22:50→dosiris: 不要開槓桿 不要碰期貨 定期定額005010/04 22:51→dosiris: 未來的你會感謝你自己10/04 22:52推gkkcast: 5年100萬很少了。快去工作回來繼續玩啊10/04 22:52→brass: 賭博可以 但不要騙自己是在投資10/04 22:52推kanehhh: 覺得先做好個股，直到策略重覆執行穩定獲利後再做衍10/04 22:53→kanehhh: 伸金融10/04 22:53推otonashi1003: 好了啦，乖乖上班打工，沒幾年又是一尾活龍10/04 22:53推loveup: 為啥不做多?10/04 22:54→timmy878787: 才賠一百萬就當學費吧 沒操作天份就定期定額只進不10/04 22:54→timmy878787: 出就能賺錢了10/04 22:54推iore12345: 買大盤ETF就好，換個心態想，五年前就定期定額005010/04 22:54→iore12345: 現在都已經噴到哪邊去了10/04 22:54推jason401310: 直接再去貸個200萬只買大盤，放個十年也不會輸10/04 22:55推livewater: 超級大多頭不做多搞到賠錢，真的問號10/04 22:56※ 編輯: bumimo2801 (210.62.204.184 臺灣), 10/04/2025 22:56:27→Obama19: 一般人玩現貨就夠了 這年紀本業還是比較重要10/04 22:56→livewater: 我4月大跌時也賠到-17%，跟著多頭走現在+29%10/04 22:56推fg008kimo: 賠100多萬當繳學費+1 而且還年輕 現在痛總比以後4.510/04 22:57推qxpbyd: 我年初開槓桿all in正二 四月-50% 完全沒動 現在+2710/04 22:58→qxpbyd: %10/04 22:58→fg008kimo: 十歲痛好多了  操作邏輯本來就是慢慢做中學的10/04 22:58→qxpbyd: 不會玩期貨不如買正二省心10/04 22:58推cblade: 年輕本業也不錯 未來是你的10/04 22:58→reallurker: 沒有長期研究就快速轉換 在賭不要說自己投資好嗎?10/04 22:58→ukikaz: 五年100萬真的沒什麼 好好工作吧 身體顧好價值50010/04 22:58→ukikaz: 萬10/04 22:58推PG24DL0: 你只是在賭 今年若沒賺到 真的不要玩了 好好上班10/04 22:59推favorite: 你還有加密貨幣可以玩10/04 22:59推elfish123: 砍掉整套，重來投指數替你女友拜託你10/04 22:59→qxpbyd: 你還是買大盤吧 真的想賭拿10%去玩10/04 23:00推jason401310: 剩10萬的時候你該去增貸的，拿去買正二已經倒賺10/04 23:00推pwseki206: 施主，你要不要考慮TISA台灣加權指數基金就好?不能10/04 23:00推wsp151515: 感覺要看一下久留美10/04 23:00噓Barefoot24: 文章真的很長沒重點，真的是醫學系的？10/04 23:00→pwseki206: 大富大貴但長遠來看要賠錢挺難的10/04 23:00→jason401310: 如果連大盤都恐懼還是別投資了，定存10/04 23:01推FIFI8488: 還好 只有賠10010/04 23:02推snowstorm: 還這麼年輕 專注本業 耐心存股 會有很好的回報的10/04 23:02噓stepnight: 沒賠到陽痿的都是小Case，你還會再搏的10/04 23:02→stepnight: 你就是只適合買正股、指數、永不做空10/04 23:02→stepnight: 股市就是有人賠錢才有人賺錢，零和遊戲10/04 23:02推newyanew: 如果不是創文 會笑死 是在瞎忙什麼 五年放定存還有10/04 23:03→newyanew: 賺錢10/04 23:03推bigwate: 我看你還是乖乖去定期定額大盤ETF啦10/04 23:03→stepnight: 年輕賠一賠、賠個痛、買個經驗剛好10/04 23:04→stepnight: 才不會當你老了，更會賺的時候，金額更大10/04 23:04推zigq: 賺夠了再回來繼續賠10/04 23:04※ 編輯: bumimo2801 (210.62.204.184 臺灣), 10/04/2025 23:05:49→choh: 把股市當成賭場進出，要怎麼贏？10/04 23:04推forb9823018: 權證絕對不要碰 能長期賺錢的可能一萬個都沒有一個10/04 23:04→forb9823018: ，期貨除了大盤和台積電，其他不建議碰，就算這兩10/04 23:04→forb9823018: 檔也建議做多就好10/04 23:04噓northsoft: 好亂，沒任何意義的回憶文10/04 23:04推Lhmstu: 賭的不錯，下次多注意點，等你某天想通就會開始賺10/04 23:05→Lhmstu: 錢了10/04 23:05推pinraychen: 我無腦買tsla從480買回200到現在損益都40%了10/04 23:05推good5755: 藥師？10/04 23:07推zeroBB: 很多賠錢的散戶沒你的勇氣承認，你很不錯了。除非10/04 23:07→zeroBB: 像我一樣，在股市廝殺是興趣，不然一般人好好工作10/04 23:07→zeroBB: 買GG、0050、美股市值前幾大的幾間就好10/04 23:07推NovaShin: 玩到敗比勝多就要收手了 阿祖10/04 23:09推ericno153: 把標的名字遮掉就是一個人在各家賭場流連忘返的故事10/04 23:10→miyabicheng: 我是你女友我會跑 好好珍惜她==10/04 23:12推LORDSKERR: 以前年輕也喜歡亂買，賠得真的賺回來就好了，後來只10/04 23:13→LORDSKERR: 買0050跟台積，這幾年真的是睏罷數錢10/04 23:13推SLOWFAX: 這不是跟賭博的賭徒一樣嗎，老天爺一開始給你點甜頭10/04 23:13→SLOWFAX: ，再來就讓你賠光，你居然還去借貸繼續賭，還好還沒10/04 23:14→SLOWFAX: 去借高利貸或被詐騙10/04 23:14推clamperni: 為什麼你們女朋友老婆都這麼好10/04 23:14→tinybunny: 泥在賭泥知道嗎?10/04 23:16推yangtsur: 26歲就有這認知很好了10/04 23:16推g0t24568: 其實也不用太擔心 股市長期往上 找好股票抱 4月也一10/04 23:16→g0t24568: 度賠300萬就是了10/04 23:16推Lamigirls48: 四月我也陪很慘 最好靠正二全部回來10/04 23:18→Lamigirls48: 最後10/04 23:18推g0t24568: 人生就是經歷過賠錢 投資定性才會夠10/04 23:18推ENCOREH33456: 還不如傻傻買比特幣，在那邊接股市老人的盤，浪費時10/04 23:19→ENCOREH33456: 間10/04 23:19→g0t24568: 長榮那波賺錢 但一檔晶豪科就全輸光 所以把它當作磨10/04 23:19→g0t24568: 練就好10/04 23:19推huabandd: 你這一看就是凹單，你個性不適合交易10/04 23:22推KTFGU: 賭博好恐怖....感謝分享10/04 23:22→huabandd: 給你什麼策略都沒用，凹單必死10/04 23:22→reddeath106: 所聽所見皆盲盒,只有<1%人會賺,建議定存,認命工作cc10/04 23:22→whatyousay: 其實說這五年是多頭也是看照後鏡開車啦，不過賠一10/04 23:23→whatyousay: 百就年輕當個經驗，好好工作也是三年就回來了10/04 23:23推g0t24568: 但我是覺得剛出社會五年 投資自己比較重要 累積人10/04 23:23→g0t24568: 脈也是投資的關鍵10/04 23:23推griffenchen: 不守紀律不適合玩啥期指當沖,乖乖的去買ETF做中長線10/04 23:24→whatyousay: 看清楚自己的天份對人生不是壞事10/04 23:24推dapple: 投資能踩的死點你都踩過了，感覺這五年你沒什麼成10/04 23:24→dapple: 長，你先把本業顧好，慢慢還債，有多的錢丟0050就10/04 23:24→dapple: 好了，不要貪心10/04 23:24→Zaqjim: 為啥你要開槓10/04 23:24推syrinx: 五年來我定期定額大盤 本金都翻倍了10/04 23:25→griffenchen: 先把貸款還完,離開市場冷靜一下吧,年輕還能東山再起10/04 23:26推boydoop: 你這個比上禮拜八年級的文好多了，以前六跟七年級10/04 23:26→boydoop: 網路資訊不多，現在的年輕人真的很幸福很早就能接10/04 23:26→boydoop: 觸投資，慢慢累積資產吧10/04 23:26推joe718: 其實可以評估自己是否適合做短線，或許長線會比較適10/04 23:27→joe718: 合，讓自己開始能賺到錢，有好的循環，才能往下走10/04 23:27推st264201: 好慘 有分享給推10/04 23:28噓bandit12344: 玩期貨不停損，你以為你是神？10/04 23:28推Yishanhuang: 感謝分享，雖然我原本是點進來看少年股神XD10/04 23:29推henryeech: 早點看清是好事啊我35歲前賠快200後才看清 之後就只10/04 23:31→henryeech: 買大盤etf 現在已倒賺20010/04 23:31→zeroBB: 少年股神，八年級系列文很多了，肯承認賠錢的人才10/04 23:32→zeroBB: 難得。10/04 23:32推NovaShin: 真的 記住這次原因 下次不能再犯10/04 23:35→budaixi: 賭博就是有輸有贏，下次再贏回來就好了。10/04 23:38推dotelroy: 兄弟 買大盤ETF就好10/04 23:38推syrinx: 年輕人無腦買大盤才是最賺的，沒有時間研究成本，也10/04 23:38→syrinx: 不用情緒價值成本，可以專心顧本業提升自己10/04 23:38推gohow: 這賠小錢而已  改一下策略  這遊戲還是可以玩的10/04 23:39推aegis80728: 剛進股市會這樣正常 心態不對 策略會亂做  之後你10/04 23:39→aegis80728: 會慢慢找到適合自己的做法10/04 23:39推kiwi3741722: 投資前兩年賠錢+1 上上下下也吐了半百 第三年才有起10/04 23:40→kiwi3741722: 色 一起繼續再股市生存吧 加油bro10/04 23:40噓timmy8812: 不要騙自己是在投資10/04 23:41推lnonai: 大多頭做到賠錢10/04 23:41推fiend0229: 連風控都做不好跟我說你在投資？送錢王還差不多，沒10/04 23:42→fiend0229: 那個屁股就不要亂玩真的沒比較厲害10/04 23:42推Ydarvish: 推~這篇真的是勸世文10/04 23:42推dean1005: 推10/04 23:43推JingPingKing: 不忍噓10/04 23:43→dongdong0405: 到底在亂玩什麼= =10/04 23:45推ATTwo: 沖就是賭博的開始，心態不夠好就是在那邊洗來洗去10/04 23:46→Ydarvish: 最近開始工作發現同事都很喜歡聊股票 說在投資但常10/04 23:46→Ydarvish: 常「交易」「波段」掛在嘴邊10/04 23:46→Ydarvish: 有一次好奇問一些人這幾年賺多少10/04 23:46→Ydarvish: 結果不要說贏大盤0050了 沒賠錢就不錯了10/04 23:46推k798976869: 賭博沒有人說不好 但不要騙自己在投資10/04 23:48→k798976869: 小賭怡情 大賭翻身 或破產10/04 23:49推Ydarvish: 我後來想想也是，如果大家真的這麼厲害都會玩股票10/04 23:51→Ydarvish: 、穩定勝出，那也不用跟我一樣來工作了XD 所以我剛10/04 23:51→Ydarvish: 出社會就看清 還是努力工作 然後選擇一起參與全球10/04 23:51→Ydarvish: 經濟資本成長就好...10/04 23:51→Ydarvish: 說到底在那些零和甚至負和市場交易還能穩定賺錢的10/04 23:51→Ydarvish: 絕對不是你我這些平凡人10/04 23:51推swli0523: 加油 沒事的不要想那麼多10/04 23:53推qpqp1: 我沒有說賭不好，但你不要騙自己在投資嘛10/04 23:54→fishouse: 未看先猜一定是沉迷於技術分析10/04 23:55推Beantownfan: 至少你還有女友10/04 23:56→k798976869: 策略有問題 攤平是要長期投資 你要玩短線波段一定要10/04 23:57→k798976869: 有紀律 是靠移動停損出場才能吃到完整大波段 大部分10/04 23:57→k798976869: 時候是小虧停損出場10/04 23:57推zxcjimyou: 你下單的時候爽不爽 有爽就沒事啦10/04 23:58噓Deltak: 賭博不要騙自己在投資，染上賭癮就是這樣10/05 00:01推phate06: 跟川普政策下資金的方向 稀土能源電網無人機trytry10/05 00:01→k798976869: 你賭徒路線 股票 期貨 再來玩選擇權10/05 00:02推EddieWuRJJ: 大部分都跟你一樣10/05 00:02→k798976869: 槓桿更大 才能凹回來10/05 00:02推roseritter: 韭留美 參考一下10/05 00:03推white1861: 有點誇張...隨便一隻買著抱5年都會賺吧......10/05 00:04→white1861: 謝謝你的分享10/05 00:04推cetus: 走了五年的大多頭能賠錢也是不簡單10/05 00:04推bbignose: 這是老天收你，要你安穩工作買指數，不要想有的沒的10/05 00:05推jameswang278: 丸子，空軍認輸....10/05 00:05推YU0121: 當沖 權證 期貨 你還真會玩 沒意外下一篇應該是跑路10/05 00:05→YU0121: 文了 或者社會頭條文10/05 00:05推Tatsuya72: 兄弟，上天告訴你財富來自於本業，專心工作就好10/05 00:06推meipialoha: 我從來只買0050 放著到現在報酬率就20%了 整天玩金10/05 00:06→meipialoha: 融商品 還賠錢到底在幹嘛10/05 00:06推maxmaster: 可能要找些方法 持續找 投少一點 小小坐10/05 00:07→maxmaster: 80%買0050 20%拿去練技術 小台 微台開練就好10/05 00:07→zack867: 所以你學會判斷和控制風險了嗎  小心老了被詐騙10/05 00:09推CAFEHu: 股蛙：別被留言影響，一堆翻身上節目暴富的來賓10/05 00:11→CAFEHu: 哪一個不是賠到爆炸過來的？10/05 00:11推qtzbbztq: 還年輕 不要再想著要賺快錢 一切都會好起來 定期定10/05 00:11→qtzbbztq: 額0050就對了10/05 00:11推no2muta: 年輕又是好學歷 乖乖買大盤啦10/05 00:13→snowish: 操作期貨不守紀律就是輸到脫褲，看內文你好像不知道10/05 00:14→snowish: 怎麼賺怎麼賠的，根本是賭博；要嘛認清自己不適合10/05 00:14→snowish: 操作，要嘛好好調整心態，不然再多錢都會賠光10/05 00:14推TIPPK: 可以理解 我四月關稅日損益是負的，資產約八百的其10/05 00:14→TIPPK: 中六百借的。我當天跌停的損益虧了總共接近五百10/05 00:14推moto000: 原來還是有人賠錢 不孤單10/05 00:15→TIPPK: 雖然我現在損益是回到正的，不過我覺得算是運氣好10/05 00:16→TIPPK: ……10/05 00:16推CAFEHu: 十倍蛙：簡單說認輸就是去買005010/05 00:16→CAFEHu: 承認自己這輩子沒超額報酬暴富的命10/05 00:16推prostar: 請出場別看股市。等心態調整好10/05 00:17→CAFEHu: 翻身百倍仔：50在某種程度上也算是一種舒適圈10/05 00:17推ben6421463: 你就買0050跟SPY就好，不要看盤了，專心看著你的本10/05 00:17→ben6421463: 業跟家人吧10/05 00:17推rabbit61677: 投資搞到會違約交割就本末倒置了，表示你在玩10/05 00:18→rabbit61677: 一個無法承受風險的遊戲，被迫砍部位之後只會後悔10/05 00:18推aling1205: 你還年輕，100萬以現在來說真的不算很多，建議你本10/05 00:18→yunf: 其實我不信你是醫生 醫生哪有那麼笨，而且有學長和10/05 00:18→yunf: 同學和家人都有經驗，甚至其他朋友要倒沒那麼容易10/05 00:18→aling1205: 金80%買市值ETF，20%去操作短線，這樣養成控制資金10/05 00:18→aling1205: 紀律10/05 00:18推YOYOISGOOD: 一堆人把賭博當投資…真的要有耐心和信心 且不能貪10/05 00:18→TIPPK: 我記得我正二當初賠35%以上，總共應該有700多快80010/05 00:18→TIPPK: 萬正二10/05 00:18→rabbit61677: 試也試過了，還年輕早點認清自己能力回頭買指數10/05 00:19→yunf: 如果是那種復健師 什麼職能治療？還是物理治療呼吸10/05 00:19→yunf: 治療之類的就有可能放射師10/05 00:19→CAFEHu: 風險蛙：年輕有本錢犯錯，但重複錯不能再犯10/05 00:19推aray0625: 你不適合賭博10/05 00:20→TIPPK: 算了一下，第一天我應該是負300多，我記得我要補兩10/05 00:20→TIPPK: 百多萬平維持率10/05 00:20推ksbshung: 就是賭博 然後越玩越大輸越多10/05 00:21推keltt: 本業薪水高的話，年輕時賠個上千萬也是輕鬆賺回來10/05 00:23→keltt: 啦，免擔心10/05 00:23推ChikanDesu: 怎麼好像某個股市猴子影片10/05 00:25→kiwi3741722: 原Po不是說自己非醫牙 可能是藥？10/05 00:25推saccharomyce: 開頭就說非醫牙了10/05 00:26噓Leon0810: 你這是賭博猜邊啊，哪是投資XDDD10/05 00:27推DOMENKING: 嗯…那就大方承認自己的認知有誤區吧10/05 00:27→DOMENKING: 回頭是岸10/05 00:27噓iahc5566: 台指根本不適合抱波段10/05 00:29推waloloo: 年輕還好啦10/05 00:29→henrylin8086: 就……老話一句，賭博就不要騙自己在投資10/05 00:31推zxcvbnm2010: 沒事啦 我也兩天賠過180多萬10/05 00:38推wishfisher: 看完發現結局是你還是沒有得到教訓啊，你應該會繼續10/05 00:38→wishfisher: 賠下去10/05 00:38推a1992515: 我覺得說出來 就贏一半了 加油 重新來過10/05 00:39噓strlen: 我不是說賭不好 但是你不要騙自己在投資嘛.jpg10/05 00:43噓hank11431: 事後論看4月不爆你怎麼不看看你其他操作爆多慘，不10/05 00:44→hank11431: 要幻想了就你自己爛，我認識多的牛b操盤手10/05 00:44→strlen: 根本韭留美真人版耶 原PO看不看漫畫？趕快去找來看10/05 00:44噓newaqua: 文筆甚差矣10/05 00:50→lonechaos: 你好愛看空==10/05 00:50推andykao082: 謝謝分享，真的別碰不然買etf10/05 00:51推Roger5566: 好心人來發勸世文 期貨只適合高手玩10/05 00:52推bigair888: 網友們認真了，版主是醫生，未來本業隨便都賺回來10/05 00:52推xkso: 好長10/05 00:52→xkso: 不懂幹嘛做空。 市場80%都是多10/05 00:53推katana89: 台股 簡單10/05 00:55推kendavid001: 很寫實的散戶 加油10/05 00:58推ac1102: 本來想給點建議，看到前面這麼多人寫，算了10/05 01:02推gotwins: 大道至簡,買0050就好了,瞎忙什麼10/05 01:05推sa87a16: 簡單說就是方向做錯，你跟世界在對幹10/05 01:08→sa87a16: 美股的歷史股價拉出來，都是往上做空等於是挖土埋10/05 01:09→sa87a16: 自己10/05 01:09→uft10517417: 希望你是真的醒了10/05 01:11推drinkmywater: 他說他不是醫師了吧 醫師不需要貸款100萬去玩 我學10/05 01:13→drinkmywater: 長一年賠了500多萬 跟我一起上課的時候 笑笑的說 今10/05 01:13→drinkmywater: 年不敢玩了 好好看診上班XD10/05 01:13推as6633208: 期貨R，只看報酬不看風險，保證金就是在教你做人的10/05 01:15→as6633208: 然後講到指數總是被大家嫌賺太慢，然後瞎忙五年，績10/05 01:16→as6633208: 效還輸無腦指數，LOOP10/05 01:16→naygnehc: 反正還年輕，賠掉的不過是人生總資產的一小部分10/05 01:18推howeee: 勸世文 給推 最近我也當初虧了幾萬元 看到這篇文後10/05 01:18→howeee: 有點被敲醒了！10/05 01:18推gooddogleg: 別想你在投資，就想這些是你的娛樂費就好，加油！10/05 01:18→racing615: 最近當沖心態也不正確越玩越大賺的也賠光 有我陪10/05 01:21推wothr:https://i.imgur.com/ar26u2c.jpeg10/05 01:22推aa01081008tw: 最典型的學一堆理論.分析一堆情勢然後輸無腦ETF..10/05 01:23噓callhek: 醫生可無限回血 不用怕10/05 01:23推CAFEHu: 牛頓：帳戶地心引力的教訓，請務必學好10/05 01:26推ao40418: 這篇是ai創作文嗎10/05 01:26推taiwanbear1: 幫QQ，相信多學可以找到適合自己的方法10/05 01:28推pttchips: 我長榮廣達也慘賠 但還好大部位在0050跟美股10/05 01:42推houjay: 26歲有這些經驗只賠100是好事10/05 01:42→houjay: 未來妳會賺回來的10/05 01:42推shawnfu: 承認賠錢是需要勇氣 來美股買mag7 or VOO 很難賠錢10/05 01:47噓Ponimp: 可憐10/05 01:58噓IQIQ200: 因為你是在賭博 不是在投資10/05 02:08噓bpq302302: 我沒有說賭不好但你不要騙自己這五年是在投資10/05 02:08推roy12345: 做交易沒計劃？10/05 02:14推fantasyscure: 我朋友沒在管總經 台指期一年賠200萬 一樣嘻笑自如10/05 02:16推gn00715334: 期貨真的是不能買在高點 但偏偏新手碰期貨又很愛追10/05 02:22→gn00715334: 高 我懂原po的痛~~10/05 02:22推Top5566: 年紀跟你一樣 2022歐印nvda 已經賺了1000萬了10/05 02:27推wwwwwwww: 記得戒賭，你就賭徒心態10/05 02:34推qoojo2002: 你知道你只要買0050就好，想東想西就是貪10/05 02:35→qoojo2002: 大屠殺再all in 怎麼輸？10/05 02:36推chou3321: 至少有享受到賭博的刺激感 無價10/05 02:50推lkjfds: 短線操作者只有1%的人能賺錢10/05 03:19→lkjfds: 建議你買只買現貨 嘗試了解比特幣看看10/05 03:19→lkjfds: 少碰槓桿 少做空 靠時間慢慢磨 無限DCA10/05 03:19推RealID2018: 要不要買0050就好，真的困飽數錢10/05 03:28→RealID2018: 雖然不多但很穩10/05 03:28→RealID2018: 我覺得你一開始就不應該碰期貨的10/05 03:29→RealID2018: 我覺得你最大的問題是都碰槓桿的東西，不是權證就是10/05 03:30→RealID2018: 期貨，沒辦法凹單10/05 03:30→RealID2018: 如果你那些都是現股，其實現在都凹到賺錢了10/05 03:30推sofar302: 倒底是誰教你這樣玩的 一整個再賭博？10/05 03:38推a16625t: 蠻厲害的 我也剛入門五年左右 30滾到破百10/05 03:41→a16625t: 賭博就是賭博 不要說服自己在投資10/05 03:41→a16625t: 五年你只丟指數隨便都賺超過一倍10/05 03:42→zxcv91039: 你真的是醫生?10/05 04:05推molopo: 周冠男看一下10/05 04:15→molopo: 先0050 你知道0050這三年賺快一倍嗎10/05 04:16→jie5317: 槓桿如果會停損還好吧？10/05 04:18推herculus6502: 綠角的書快去買來看一看 小心駛得萬年船10/05 04:31推topfree: 呃..除非你很有把握不然不要信貸啊..10/05 04:35推pimba17: 2020什麼都漲真的賠了一堆少年股神10/05 04:53推Lamigirls48:https://i.imgur.com/gk8c1Zo.gif10/05 05:34→silentence: 人就是這樣 超出你能力可評估的風險 = 無風險10/05 05:48推abyssa1: 買指數就好 貸款又加期貨槓桿 心態很難穩定10/05 05:49→silentence: 碰期貨才賠這樣而已  就知道現在市場多好  以前隨便10/05 05:50→silentence: 都可聽到幾千萬被直接扛出去的10/05 05:50→silentence: 也不會死啦 認真工作賺個5年就還完了 差不多人生3010/05 05:51→silentence: 從頭累積資產而已  不果你一定還是會去賭然後越欠10/05 05:52推hotking: 好多快樂寶貝！10/05 05:52→silentence: 越多而已  看太多這種人 市場大順風時就想一直凹10/05 05:52→silentence: 逆風時以為來個反向操作就可以贏  笑死10/05 05:52推bookway: 送你五個字 GG無腦多 以後你會謝我10/05 05:55噓tpta45855: 幹你醫生欸 三小這樣也要哀10/05 06:11推opop1133: All in 005010/05 06:12→zxcv91039: 睡飽才看清楚 原PO非醫牙 買車價位大概藥師吧10/05 06:14推opop1133: 兒子出生後就開始幫他定期定額，目前兩歲獲利都屌10/05 06:15→opop1133: 打你了…10/05 06:15推greedypeople: 我沒有說賭博不好 但你不要騙自己說是在投資嘛10/05 06:17推quanhwe: 剛開始用1000美練習一下 一開始就全投風險太大10/05 06:24推pikaq: 方向不對，就要停損了，除非是明確大牛市，否則嚴禁10/05 06:36→pikaq: 加碼攤平。平常也是嚴禁開槓桿。再賠也不會賠到哪10/05 06:36→pikaq: 裡去。畢竟突然金融風暴那種賣不出去的大意外太少了10/05 06:36→pikaq: 。10/05 06:36→suiks: 怎聽起來比較像進賭場五年的心得10/05 06:39噓matto: 你完全沒有天份.... 收手吧 認真從病患挖錢吧10/05 06:48→matto: 證明了會不會做交易跟學歷真的沒太大關係10/05 06:48噓GimO: 送你四個數字財富密碼 0050 不用謝我了10/05 06:50推mirroshadow: 你這個就是典型的賭徒心態10/05 06:50推vovovolibear: 信貸玩期貨，這是14倍的槓桿啊！10/05 06:55噓g007: 沒單，且整篇文章有點冗長。。，簡單來講操作股期荒10/05 07:07→g007: 腔走馬 亂七八糟 心態完全不對 大賠小賺10/05 07:07→kiki86151: 心態不對 就算賭要閒錢 不是借的 血本無歸還是能吃10/05 07:07→kiki86151: 飽睡好 之前空頭負200我也沒怎樣 凹到現在定期定額10/05 07:07→kiki86151: 都變成正的了10/05 07:07推zaqimon: 如果你的長輩有錢你根本不需要憂鬱10/05 07:10推jsdf: 你去澳門玩贏面可能還比較高10/05 07:11→zaqimon: 不過醫生怎麼感覺這麼閒可以當沖10/05 07:11噓TrySoHard: 一堆人文章不看就在評論，他一開始就說非醫牙了10/05 07:15推ben6421463: 非醫牙，那大概是藥師或治療師，定期定額的能量應10/05 07:21→ben6421463: 該蠻強的10/05 07:21→BUKU: 這才是多數人吧10/05 07:25→BUKU: 四月到現在有賺的跟本沒聽過幾個10/05 07:25→eemail: 非醫牙寫這麼清楚 睜眼瞎真的不少10/05 07:25→BUKU: 四月砍掉賠得 後面再進場 也很難賺回來 更別說一對10/05 07:26→BUKU: 人被債套住10/05 07:26推bluemanhaha: 嗯...至少現在還活著10/05 07:27推mvpdirk712: 嘗到甜頭就開始大意，一開始定期定額買0050不就沒事10/05 07:28→mvpdirk712: 了嗎？10/05 07:28推n555123: 我看完第一個想法是21歲就入市試錯整整五年才賠一10/05 07:34→n555123: 百多還是比我當時年輕多了有的是機會，年輕真好QQ10/05 07:34→n555123: 我認為問題是你這五年不像有進步，你一步一步越賭10/05 07:34→n555123: 越大、用的方法越來越高風險，老實說我沒意見因為10/05 07:34→n555123: 你總要吃屎學個教訓，但我認為一些操作你始終沒修10/05 07:34→n555123: 正過來代表你閱讀量跟研究量不足，比如「攤平」10/05 07:34→n555123: 最後我建議你先定期定額0050，來日方長10/05 07:34推jim80227: 你誤認自己一年能賺多少錢  缺忽略一輩子能有多少10/05 07:35→jim80227: 收入10/05 07:35推HOMEWA: 認真回 先看點書吧...你現在玩的是賭場,不是市場10/05 07:39噓Stat14: 在忙什麼？買0050都屌打你= =10/05 07:44推nicexd: 還好你只有借100 加油 慢慢賺回來10/05 07:46推tswen: 績效超爛 不如5010/05 07:52推mutzy52000: 醫院非醫牙還要國考，醫檢師之類的吧？10/05 07:54噓syrctiger: 菜雞舞大刀，盲目，以後不要玩了10/05 07:55推Riesz:    完全沒有""為什麼""買  只有買賺上癮  賠錢上頭10/05 07:56→Riesz:      套句師傅對媽媽的說法  妳這叫流水帳不叫心得~10/05 07:57推gs1511: 100w繳學費其實還好啦 今天開始認真生活買指數吧～10/05 07:58→gs1511: 生活很美好的～10/05 07:58推Riesz:    師傅常說  我們是投機  賺時機財  只不過~~10/05 08:02→Riesz:    我們是會算牌的賭徒  不會算  頭腦昏沉  不賭~~10/05 08:02噓tenkaakido: 拜託你多發多空文，冥燈10/05 08:03噓love555666: 接下來信貸歐印空 應該可以賺爛 台灣紅利差不多了10/05 08:07推terryporter: 加油啊 能貼文勸世已屌打一群酸民10/05 08:08推ubei: 真的不如買0050,我從幾年前就0050和VT定期扣款了10/05 08:09→ubei: 個股拿個20%資金好好研究買來玩就好了10/05 08:09推djbell: 買0050已經贏過在場一半的人了10/05 08:10推oxhill: 不要買期貨.只買 etf 再怎麼樣也不會賠光.穩健投資10/05 08:12→oxhill: 才是王道吧10/05 08:12推ubei: 不過如果你買ETF看到綠的也會害怕到想賣,你可能要花10/05 08:15→ubei: 點時間好好研究投資這件事才對10/05 08:15→lahugh: 一直看錯不認 越賭越大賠錢剛好而已 定期定額大盤當10/05 08:19→lahugh: 個氣氛仔 怎麼沒有學到這個…10/05 08:19推redbeanbread: 換邊就財富自由了吧10/05 08:22噓newlie83: 紅明顯 建議有買賣就發文 你賠錢 大家賺 會很歡樂10/05 08:25→newlie83: 否則 你每天進出賠錢 只自己鬱悶 長期下來身心不好10/05 08:25推doomster562: 別再借錢買股票了10/05 08:28推daylight9157: 少年股神心態。只能說節哀10/05 08:31→daylight9157: 如果那個時候相同金額壓0050到現在你應該富到流油了10/05 08:31→daylight9157: 。10/05 08:31→daylight9157: 這個心態真的不是在玩股票是在賭博。10/05 08:31→daylight9157: 我也跟你差不多時間投入，但我基本上只買0050，中間10/05 08:31→daylight9157: 因為要用錢賣了不少，還有被高股息騙到虧了一些錢。10/05 08:31→daylight9157: 現在+26%供參10/05 08:31推haganin: 我2013歐債危機第一次接觸期貨，也是跟你一樣一直空10/05 08:33→haganin: ，往上軋不停損還一直加碼攤平，最多空大台8口，最10/05 08:33→haganin: 後躺平賠100萬。今年4月解放日操作有精進，多空都有10/05 08:33→haganin: 做，把以前虧的都賺回來逆轉勝，報酬1500%,現在開始10/05 08:33→haganin: 工作就只買0050了10/05 08:33推JRbluesky: 股市儘量別做空吧 多比空勝率還高的10/05 08:36推Sonas: 投資是要賺錢 不是要證明你有多厲害 會很多種標的10/05 08:36推haganin: 0050 5年前放到現在，還原權值15漲到60,大賺4倍，建10/05 08:37→haganin: 議你還說玩005010/05 08:37推hom: 其實穩穩投2330就好10/05 08:52→tsubasa1116: 做空賠錢為什麼不做多？我剛玩期貨也是賠10萬，後10/05 08:57→tsubasa1116: 來只做多不賺快錢花幾個月時間已經賺回來了10/05 08:57→tsubasa1116: 玩期貨不要跟趨勢對做10/05 08:58推kenyclapton: 錢10/05 09:01→zer0319: 乖乖買指數可能都存到頭期款了10/05 09:05→dragonjj: 這種盤你空真的是保重，多可以等空就下輩子見10/05 09:10推aro3810: 買50不如買台積，賺更多10/05 09:12推Riesz: 多跟空  看熊市或牛市  但台灣政府會QE  禁止平盤空10/05 09:14推gn7722: 小卡拉咪的資金，操作的跟什麼大型機構一樣10/05 09:15→gn7722: 貸款賭博，真有你的10/05 09:16→trader79: 難道一見 賠錢的10/05 09:23推FULLHD1080: 26歲賠100多萬還好吧,少年古神賺到幾百萬那種才是10/05 09:29→FULLHD1080: 麻煩10/05 09:29推rea1: 可以侃侃而談你已經走出第一步了10/05 09:29噓kissyourbi: 賠錢廢文 浪費時間10/05 09:33推leisesnow: 醫生收入不錯，先穩住心態，儲一桶金，再用閒錢玩。10/05 09:35推Imgoodjob: 只是在賭博而已10/05 09:36→Sonas: 長輩也蠻嘴砲的 投資該學沒錯 但沒跟你說啥不能碰10/05 09:38推nekomo: 我也是認輸 覺得就定期定額0050/2330吧10/05 09:45→nekomo: 飆股 期貨雖然很有吸引力 但真的就像賭博 不是投資10/05 09:46噓Kobe5210: 醫生好好的專注本業吧10/05 09:48推sqt: 恭喜您被教訓不到1百就覺醒了.先沉澱累積實力10/05 09:50推OneDianHwen: 還年輕 又是醫生 沒什麼好怕的10/05 09:59推iamiam: 從2020年開始乖乖買0050、2330，放著不賣也不會賠10/05 10:00推Milkomeda: 1.不要做空 2.控制槓桿倍數10/05 10:01→W22938427:https://i.imgur.com/E6FQw1F.jpg10/05 10:04推SRmoisTEH: 沒研究 你就只是在賭博r....10/05 10:05推sunandmoonof: 殺不死你的必使你更強10/05 10:13推fcuhua: 賺錢抱不住 賠錢不敢砍 股債黃金加密貨幣隨便買放10/05 10:17→fcuhua: 著數錢不好嗎10/05 10:17推fcuhua: 醫生要復活很快 本業持續輸血沒一年就回來了10/05 10:19推xfile: 這是在賭博吧  沒事  繼續借錢賭下去 有一天能夠翻10/05 10:22→xfile: 身的10/05 10:22噓s930406: 歐印大盤10/05 10:22推airyptt: 謝分享 真的不要賭……10/05 10:24推avmm9898: 我都建議一般人借錢當沖，但你太可憐了..建議收手10/05 10:26→prussian: 放心，這種的只是情緒上頭，只要沒剁手，過了幾天10/05 10:30→prussian: 一定重回賭場博翻身。10/05 10:30→prussian: 銀行為了獲利鼓吹年輕人借錢透支未來也是垃圾10/05 10:30推ag0953: 我剛進股市前二年就賠160了，你還年輕，一定可以重10/05 10:31→ag0953: 頭來過的10/05 10:31推dbdudsorj: 安啦 看多了 最後就是仗著本業薪水高繼續把股票當10/05 10:33→dbdudsorj: 賭博 然後人生開始走偏 至於怎麼偏點到為止10/05 10:33推crusoe: 賭博跟交易天差地別，很多人搞不清楚，以為是「玩」10/05 10:35→crusoe: 股票「玩」期貨，事實上被玩的是你10/05 10:35→dbdudsorj: 等到賠錢賠到影響職場表現的時候 就是出包的時候10/05 10:36→dbdudsorj: 出包後還能不能有高薪的本業呢？10/05 10:36推dream6789: 王晶導演的短影片分享...人生吃虧是福，越早吃虧，10/05 10:42→dream6789: 成長越早。10/05 10:42推lepidoptera: 你只是在賭博 五年100萬 小賭怡情10/05 10:50推hypeng: 這是韭菜日記嗎… 但還是真心跟你分享一個觀點：可10/05 10:55→hypeng: 以問問自己，我是真的很珍惜這100多萬嗎？ 如果我10/05 10:55→hypeng: 很珍惜、覺得這筆錢得來不易、想要好好運用和安排10/05 10:55→hypeng: ，我會再用之前的模式去投入市場嗎？ 有珍惜錢的心10/05 10:55→hypeng: 態很重要，當你視錢為無物，只是一個可以讓你有機10/05 10:55→hypeng: 會翻本的工具，那錢也會視你為無物。10/05 10:55→Arkzeon: 會後悔跟反省都不算晚。而且你很年輕，本業又佳。10/05 10:56→Arkzeon: 有事後容錯空間的犯錯。是很好的精神養分。加油10/05 10:56→Arkzeon: 但還是不免要多嘴給你說：你前面的方式完全是爛命10/05 10:58→Arkzeon: 一條好漢一條的底層亡命翻身模式。你是千金之子，10/05 10:58→Arkzeon: 不該死於盜賊10/05 10:58推hihi29: 跟自己對做就贏了啊10/05 11:07推ikeepcool: 覺得可以分享自身的經驗給大家很棒！10/05 11:21推THE7088: 期貨小白想問一下 星期一放假 日經空單可以動作嗎10/05 11:22推planta: 勸世文！尤其是在現在很多F 0 M 0沒有跟上這波！這10/05 11:23→planta: 篇來的正式時候！10/05 11:23→nocash:http://i.imgur.com/Kw0B3Zl.jpg10/05 11:29推we147121: 長投美股才是最佳解，其他國家的股市都別碰10/05 11:36推Shinn826: 前面嘗到甜頭，後面成了爛賭鬼。還是好好工作買005010/05 11:36推silence1628: 加油還年輕，先買0050即可，或是盡力買第一間房，10/05 11:40→silence1628: 祝你順利10/05 11:40推jason751231: 買指數都不會嗎 去讀書吧10/05 11:50推wu2183: 太弱了 以為是無腦亂買現股做多賺大錢的心得10/05 12:03推swgun: 會買面板股跟當沖的基本上我一律歸類為爛賭鬼10/05 12:13推Hall: 願意分享給推 。10/05 12:24→Hall: 聽明牌亂買的大多最後就是韭菜10/05 12:25推Hall: 航運股這種的在疫情間被海撈一筆後炒作航運就沒用10/05 12:28→Hall: 了10/05 12:28推chipperman: 我輝達ai大噴前存700萬股，永遠記得那天盤後大漲40%10/05 12:30→chipperman: 開啟我的信貸之路。信貸陸續借到800萬，all in 美10/05 12:30→chipperman: 股ai，直到現在帳面上4000萬+，有時一天上下個200萬10/05 12:30→chipperman: 。只能說要長抱勝率還是比較高...10/05 12:30推chipperman: 但我大學投資房地產的同學們，資產都破億就是。10/05 12:31→jalai: 誠心建議: 專心工作 先定存 結婚 有閒錢定期定額VT10/05 12:39→jalai: 你的心態已經不對了  先離開市場  專注事業10/05 12:39推pighong: 這五年是股市的黃金年代，還賠錢真的是10/05 13:22推linleex: 不如買0050或存金融股10/05 13:52推brianawpak: 別自己亂操作了，找個投顧老師跟著做？10/05 13:59推howow: 加入大盤就好了10/05 14:04噓poasdm:10/05 14:12推hikku: 誠實 股版一堆大賺的反而不能信10/05 14:16推lin821: 投資長說過你是在賭不要騙自己是投資10/05 14:31推K41520: 拍拍 我今年因為四月關稅加匯率 認賠八位數 扣掉貸10/05 14:34→K41520: 款的甚至還破產 當下心如死灰 如果當初沒賣 現在也10/05 14:34→K41520: 回8成了 可惜我停損大部位 只小回百來萬 重新來過10/05 14:34推jheli: 拍拍，做為投資生涯總虧損有超過800萬的過來人，你10/05 14:38→jheli: 該慶幸你當時還是學生，所以就算加槓桿虧損也是有10/05 14:38→jheli: 限的10/05 14:38推sg1987: 跟你差不多時間進場 覺得自己不懂股票 大多買005010/05 14:50→sg1987: 挪一部分錢自己研究挑個個股買 1504 最近就睏飽數錢10/05 14:51→sg1987: 其實我隔年就被套牢一整年 只是肯死抱著不賣10/05 14:53推ms01096: 年輕時試錯不是壞事，我也是21、22當沖賠光本金10/05 14:54→ms01096: 現在定期定額指數型ETF慢慢累積資產不遲10/05 14:54→ms01096: 近兩年研究產業開始分配資產到美股個股報酬小贏大盤10/05 14:54→ms01096: 但指數型ETF仍保留一定比例，股市大起大落時很心安10/05 14:54→jie5317: 定期定額先看本金多不多吧？10/05 14:58→jie5317: 幾年前本金少我都拼個股，反正覺得錢不多賠光也沒10/05 15:01→jie5317: 差10/05 15:01推dazzzlee: 就又一個想靠小本金翻身的平凡人 少年股神文少看好10/05 15:10→dazzzlee: 嗎10/05 15:10→molopo: 很多人都小看了0050的10% 其實認真工作 信貸 房貸下10/05 15:20→molopo: 去 大資金的10%也不少10/05 15:20→molopo: 懶人包 定期定額 股災 all in 資產配置 股債配置好10/05 15:22→molopo: 不懂就問ai吧 這不是什麼神秘的東西 很多人都知道10/05 15:22推asduio: 講個直接的，你的開頭看得出來你是輸在自尊心10/05 15:26推bettybuy: 好的 這是滿多人期待看的過程……10/05 16:17噓bboyallcome: 越賠越賭耶？10/05 16:28→perlone: 反著做就會賺了https://i.imgur.com/CxkxNXo.jpeg10/05 16:30→perlone: 789月很好做  希望10月再衝一波10/05 16:32推spirit: 好寫實 幫QQ10/05 16:41推ntuooo: 觀世音菩薩10/05 17:01→perlone: 期貨市場有人賺就有人賠 你虧的被別人賺了10/05 17:07推iamjimhaha: 我是第一次看到這麼詳細的賠錢文？加油10/05 17:10推dayuer: 你才是正常人，清流文給推。10/05 17:11推jacky40383: 我沒有說賭博不好 可是你不要騙自己在投資嘛.jpg10/05 17:13推h3126187: 加油 活著就會有轉機10/05 17:34噓SmokeCloud56: 賭徒就賭徒有啥好拍拍的10/05 18:21推stubasa2: 你還有女友就贏過很多人了，要好好珍惜10/05 18:50推z2wen: 全部都是情緒操作，沒什麼投資邏輯，連買什麼都不10/05 19:14→z2wen: 知道，賭徒心態太衝動10/05 19:14推noah23: 勸世好文 不要當沖 不要期貨 不要開槓桿10/05 19:15→z2wen: 定期定額etf關掉app，比你窮忙有效益10/05 19:15推sai82320: 你本業做的好 大概也有300～500區間 不買股票也能10/05 19:49→sai82320: 有錢10/05 19:49噓medioca: 一頓操作猛如虎 還不如買大盤都賺的比你多10/05 20:35推yoshian886: 本業顧好買qqq就好，炒什麼股票？10/05 21:23推ja000123: 這5年不管台股美股買大盤都賺爛 操作猛如虎真笑死10/05 21:27→ja000123: 雖然簡單但也一堆散戶當燃料賠錢 原PO有勇氣分享推10/05 21:27推k862479k: 醫生好好上班無腦定期定額大盤，等十年後財富也能10/05 21:30→k862479k: 屌打95%普通人了10/05 21:30推cphe: 別看很多人玩期貨賺爽爽，虧的沒講而已，買指數ET10/05 21:55→cphe: F放著靠複利賺，年輕就是本錢10/05 21:55→JKjohnwick: 賭徒10/05 21:58推japan428: 沒事，這裡沒多少人被空頭清算過而已，本質他們也10/05 22:30→japan428: 是在賭政府不敢放經濟爆炸10/05 22:30→japan428: 賭到一次大蕭條這裡99趴也是躺10/05 22:31推rcf150cc: 幫QQ10/05 22:48→lredmario: 提高本業收入，設定定期定額0050，然後app刪掉 不10/05 22:50→lredmario: 要再看股市10/05 22:50推ianbomb: 醫生只要好好領薪資全部放活存就屌打99%的人了10/05 22:53→lluunnaa: 謝謝分享,失敗為成功之母,祝未來把賠的賺回來~10/05 22:57→aoiaoi: 年輕小賠 能醒悟其實是好事 怕的就是愛賭成癮10/05 23:03→maye: 年輕時遇到負擔得起的賠錢也不算壞事，總要學過教10/05 23:14→maye: 訓才會有長進。會玩到沒錢還是別亂玩了，你就是適10/05 23:14→maye: 合持續買進0050，然後不要看股市，專心工作那種人10/05 23:14→maye: 。10/05 23:14推kkrichard: 五年賠一百萬還好，職業如果是藥師，慢慢賺都可以再10/05 23:21→kkrichard: 回股市10/05 23:21推a88242978: 跟我經歷好像…今年初那波也是賺的全吐回去還倒賠110/05 23:44→a88242978: 00…QQ10/05 23:44推FULLHD1080: 人家開頭就說不是醫生了,到底一堆人眼睛是裝了什麼10/05 23:58→FULLHD1080: 東西一直說人家是醫生沒關係10/05 23:58噓littmann: ㄧ心想著要大賺的賭博心理一定賠死10/06 00:33推A90812345: 買指數吧10/06 00:33推f204137: 你真的是醫師嗎？ 投資邏輯要清楚的10/06 01:00→f204137: 沒耐心 而你槓桿開超過負荷 很容易就被掃出場10/06 01:02推LANDY740505: 以醫生來講5年100萬還好，在賺變定期定額大盤存股就10/06 01:22→LANDY740505: 好10/06 01:22推d2623: 開頭就說非醫牙了，為什麼還是一堆人覺得他是醫生10/06 01:28→d2623: ？10/06 01:28",285,34,304
